id;question;timestamp
103;Можно уточнить часы работы приёмной комиссии?;2025-06-24 16:16:57
104;Здравствуйте! Хотел на этой неделе приехать подать документы. Есть несколько вопросов. Подскажите, пожалуйста, если ещё нет аттестата, можно ли подать документы в вуз? В каком виде нужно предоставить достижения (можно ли в виде копий)?  Если мне нет 18 лет, могу ли я подать документы в вуз очно без родителей?;2025-06-24 16:44:17
105;Добрый вечер. Подскажите, пожалуйста, на какой специальности идёт более полное изучение Data science? Спасибо;2025-06-24 17:52:09
106;Добрый день. Если подавать документы нужно только через Госуслуги, нужно ли создавать ЛК абитуриента на сайте вуза?;2025-06-25 05:51:07
107;Является ли Алина Липанина сотрудником университета?;2025-06-25 06:58:18
108;Денис Сергеевич, дают ли жителям пос.Новоуткинск общежития?;2025-06-25 07:15:19
109;В т.ч жители Первоуральска? Видел про 50-километровую зону, что внутри нее не дают общежития;2025-06-25 07:21:15
110;Добрый день. Подскажите, если школа ещё не выдала аттестаты, можно ли уже подать документы онлайн, не дожидаясь аттестата, учитывая, что он потом все равно погрузится?;2025-06-25 07:25:30
111;Было объявление, что в ГУК сегодня что в ГУК сегодня встреча с представителем по информационной безопасности в 13-00. Она будет?;2025-06-25 07:58:26
112;Вопрос следующий, если у меня социальная стипендия и я планирую в этом семестре вернуться на студенческую стипендию, социальная останется такой же или нет?;2025-06-25 08:00:33
113;Здравствуйте, я могу подать документы на 5 факультетов в РТФ и на 5 факультетов в ИНМИТ или только в один из вузов  в составе УРФУ?;2025-06-25 08:22:08
114;А есть у кого-нибудь бланк с факультетами, баллами и количеством мест  на Инмит? Не могу нигде его найти;2025-06-25 09:35:14
115;Здравствуйте, я правильно понимаю, что договор на обучение можно подписать и оплатить после оглашения списков поступивших на бюджет? Допустим во 2 декаде августа.;2025-06-25 09:40:38
116;Спасибо. Оплатить надо сразу за семестр или можно за квартал?;2025-06-25 09:42:03
117;Направление = код специальности?;2025-06-25 09:57:36
118;Добрый день. Подскажите, пожалуйста, если учится на бакалавриате, реально ли попасть  на военную кафедру. Информация какая-то противоречивая. Чуть ли не 10 человек на место. И какая там именно специализация по роду войск? Спасибо;2025-06-25 10:48:39
119;А какие именно там критерии отбора?;2025-06-25 10:52:14
120;Добрый вечер! Подскажите, пожалуйста, нужно ли будет предоставить справку с места жительства и по какой форме?;2025-06-25 11:22:19
121;Здравствуйте, хотел бы узнать, чем отличаются программная инженерия и прикладная информатика?;2025-06-25 14:35:23
122;Здравствуйте, а тем кто на платное обучение поступает предоставляется общежитие и есть ли военная кафедра?;2025-06-25 16:02:07
123;Добрый вечер! Здесь информация этого года? https://web.archive.org/web/20240718140144/https://urfu.ru/ru/ratings/#342334738;2025-06-25 16:14:27
124;То есть если место найдётся, то оно на все время обучения будет закреплено, даже на заочной форме?;2025-06-25 16:35:54
125;Здравствуйте! Какие отличия в программах 10.05.02 и 10.05.04?;2025-06-25 16:42:07
126;А на время сессии?;2025-06-25 16:47:39
127;Доброе утрр! Где можно увидеть списки подавших документы на поступление?;2025-06-26 02:58:32
128;Доброе утро. Напишите про целевое обучение. Достаточно отметки в заявлении для участия в конкурсе или предварительно с организациями связываться?;2025-06-26 03:37:20
129;Доброе утро. Вопросы по очно-заочной форме обучения тоже можно задавать здесь?;2025-06-26 04:15:07
130;Добрый день. Подскажите пожалуйста, призерство и участие в региональном этапе ВсОШ по технологии будет давать дополнительные для поступления в ИРИТ?;2025-06-26 07:09:40
131;Здравствуйте! Увидел, что на сайте появились минимальные баллы для поступления на программную инженерию и алгоритмы искусственного интеллекта по 180 баллов в сумме. Означает ли это, что конкурса на платные места не будет?);2025-06-26 08:13:02
132;Можно ли одновременно подавать документы на бюджет и целевое обучение?;2025-06-26 08:30:23
133;Т.е. это ни о чем на данный момент не говорит, т к. все будет зависеть от количества поданных заявлений и в последствии согласий? Т.е. это нижний порог в моменте, который дальше будет меняться только вверх. Правильно?;2025-06-26 08:56:46
134;Здравствуйте, а если ты проживаешь в Екатеринбурге, то можно ли рассчитывать на место в общежитии в НВК?;2025-06-26 08:58:49
135;Сколько всего общежитий? Они распределяются случайным образом?;2025-06-26 09:36:09
136;А где именно на сайте  появились минимальные баллы?;2025-06-26 09:53:56
137;А в прошлом году разве не 140 было?;2025-06-26 10:51:20
138;Добрый вечер. А как происходит зачисление на целевое обучение, там же тоже конкурс по баллам? Может ли тогда абитуриент подать заявление на целевое в несколько мест и уже потом выбрать одно?;2025-06-26 12:06:23
139;"Правильно ли я понимаю, что все технологии Искусственного Интеллекта основаны на математических алгоритмах? 
Это значит, что математика будет в большей мере профилирующим предметом на направлениях  по ИИ, в отличие от остальных ИТ-направлений УрФУ. Видимо с профматом ниже 70 баллов на ИИ будет как минимум некомфортно. Кроме того, поступая на Алгоритмы ИИ или Прикладной ИИ, нужно быть готовым не только много и глубоко изучать математику, но и использовать математику в будущей работе.";2025-06-26 12:07:26
140;то есть можно подать только одно заявление на целевое?;2025-06-26 12:37:16
141;Здравствуйте, если папа у поступающего участник боевых дейсвий (чечня) , то какие нибудь преимущества/льготы булут у ребенка?;2025-06-26 14:23:05
142;"Здравствуйте! Являюсь участником очного заключительного этапа олимпиады ""Изумруд"" (в личном кабинете имеются сертификаты участника). Подаю заявление на поступление в УрФУ через портал Госуслуги. В достижениях моё участие не отражается. Как прикрепить сертификаты на ГУ  и подтвердить участие для приобщения доп.баллов?";2025-06-26 16:02:11
143;Подскажите, а номера программ индивидуальны для каждого вуза или во всех вузах 09.03.03 это прикладная информатика?;2025-06-26 17:03:34
144;"Здравствуйте!
Оставляется ли оригинал аттестата за 11 класс в ВУЗе или принимается по Госуслугам и остаётся на руках студента?";2025-06-26 17:14:05
145;Подскажите, а как осуществляется перемещение студентов от общежития в Новокольцовском? На картах вижу только маршрут с пересадками, хотя сами студенты говорили про один автобус, который ходит туда и обратно;2025-06-26 17:41:36
146;я так понял, это без пересадок. часто ходят? сколько ехать примерно?;2025-06-26 17:53:36
147;здравствуйте! Если я подам согласие на то направление, где я буду проходит по списку подавших, но туда ещё подадут и я вылечу, то меня рассматривают ниже по приоритету?;2025-06-26 18:17:49
148;а в таком случае мне надо заново давать согласие на другое направление?;2025-06-26 18:52:51
149;а если я дал согласие и по всем 5 направлением вылетел до 1 августа, то я могу подать согласие в другой вуз?;2025-06-26 18:56:19
150;Если например необходимо 170,а у меня 180, то насколько высок шанс, что я попаду ?;2025-06-26 19:04:35
151;Опыта в чем?;2025-06-26 19:06:02
152;"Доброе утро. Можно поподробнее про ""... Потом при желании перевестись к нам""? Это же работает только если будут контрактные места после того как у вас часть студентов после первой или второй сессии ""вылетит""? И вот тут вопрос: по Вашему опыту, насколько велика вероятность перевестись?";2025-06-27 03:33:23
153;Что представляют из себя траектории?;2025-06-27 03:56:48
154;Добрый день, Денис Сергеевич!Подскажите пожалуйста, куда обратиться за такой  справкой? Не много не поняла трактование статьи, хотелось бы уточнить попадаем под такую льготу или нет!;2025-06-27 05:11:49
155;здравствуйте, на дне открытых дверей вы говорили про так назывемые зеленые списки, а как и где их отслеживать?;2025-06-27 05:46:41
156;Даёт ли диплом об окончании Очно-Заочной Школы при институте математики и механики и департаменте механики, математики и компьютерных наук дополнительные баллы при поступлении?;2025-06-27 06:15:29
157;добрый день. за участие в изумруде и физтурнире баллы складываются или засчитывается только что-то одно?;2025-06-27 07:32:53
158;то есть это в любом случае маскимум +4, а не +8?;2025-06-27 07:34:38
159;запись на вступительные испытания проводится только через гос услуги?;2025-06-27 08:09:44
160;"Добрый день. 
Разъясните ещё, пожалуйста, а дополнительные вступительные испытания пишут все абитуриенты или только те, кто поступает после СПО без результатов ЕГЭ?";2025-06-27 09:33:59
161;А про какие тогда вступительные испытания интересуются выше? Я и подумала, что это как дополнительные.;2025-06-27 09:38:05
162;То есть, если я поступаю по баллам ЕГЭ, то в УРФУ будут дополнительные внутренние испытания?;2025-06-27 09:49:00
163;Здравствуйте! А на сайте урфу есть конкурсные списки просто у многих вузов уже есть?;2025-06-27 10:03:40
164;добрый день. деления на специальности или возможности выгрузить, к примеру, в csv - нет ?;2025-06-27 11:05:18
165;А где посмотреть свой номер подачи?;2025-06-27 11:05:34
166;Добрый день, подскажите, а если данные аттеста еще не загружены в гос. улугах, то подать заявление мы не сможем?;2025-06-27 12:25:00
167;"Здравствуйте! При расставлении приоритетов возможно ли ""разорвать"" программы из одного направления или же программы одного направления должны идти подряд? 
Например, возможно ли на 2 место поставить 09.03.03 прикладной искусственный интеллект, а 09.03.03 прикладная информатика на 4 место?";2025-06-27 14:49:15
168;Здравствуйте, разве существует согласие на контракт? Судя по правилам приема, аналогом согласия является оплата по договору.;2025-06-27 14:51:34
169;При подаче документов лично, есть возможность подписать согласие?;2025-06-27 16:15:33
170;С этого года новшество?;2025-06-27 16:29:41
171;Если в 5 вузов на платное подать, то каждому по 100 тысяч платить?;2025-06-27 16:30:49
172;"Здравствуйте! 
В какой период сдаются вступительные экзамены? В приёмной комиссии сказали даты,отличающиеся от дат на сайте.
И как узнать точный день экзамена?";2025-06-27 18:34:17
173;Здравствуйте, когда необходимо подавать оригиналы документов в вуз после оглашения списков? Когда в целом появятся списки зачисленных?;2025-06-27 20:05:17
174;Если я правильно понял, то после окончания приема я остаюсь в списках, то мне надо принести только согласие? Всё?;2025-06-27 20:11:27
175;Согласие на зачисление можно предоставить дистанционно?;2025-06-27 20:42:15
176;Здравствуйте. Я правильно понимаю, что до 25 июля можно менять в заявлении институты, профили и приоритеты?;2025-06-28 03:55:17
177;Здравствуйте, а если нам аттестат выдают только 5 июля, а мы хотим приехать во вторник, можно ли без аттестата подать документы?;2025-06-28 07:25:42
178;Здравствуйте. Можно получить аналитику о количестве бюджетных мест в ИРИТ-РТФ в прошлом и этом году по направлениям бакалавриата?;2025-06-28 08:06:22
179;а можно узнать какой полный пакет документов?;2025-06-28 08:28:22
180;Здравствуйте, можете рассказать, как проходят занятия на специалитете и насколько сильно они отличаются от бакалавриата? Интересует «информационно-аналитические системы безопасности»;2025-06-28 08:29:59
181;Добрый день! Подскажите, если мною выбрано 5 приоритетов и по одному из них меня отобрали и я вижу себя в списках поступивших, но!!!! в мечтах у меня другая специальность и я вижу, что по ней объявлен дополнительный набор (в моих приоритетах ее не было, тк я исходя из своих баллов побоялась ее поставить в приоритет). Могу ли я подать документы на мою мечту или я однозначно *заморожена* в списках уже поступивших?;2025-06-28 10:11:48
182;Те в принципе возможно поучаствовать в недоборе, отозвав согласие? Меня исключают из списка поступивших (там образуется дырка);2025-06-28 11:10:39
183;"Надеюсь до этого не дойдет, пока просто интересуюсь. Спасибо!
Еще один вопрос: по недобору будут сразу известны проходные баллы или снова конкурс  будет ?";2025-06-28 11:13:05
184;Расскажите пожалуйста, а что происходит на встрече с представителем программы?;2025-06-28 11:34:52
185;Денис Сергеевич здравствуйте! Заполнили заявление на госуслугах, где выбор аттестата указали ,,о среднем общем образовании,, - так написано в аттестате. Скажите пожалуйста это правильно или должно быть среднем (полном) образовании?;2025-06-28 12:00:37
186;Добрый день. Подскажите, планируется ли доработать список абитуриентов на сайте, чтобы были фильтры, или хотябы экспорт в Excel для удобства пользования? Рядовая задача для студента ИРИТ 😉.;2025-06-28 13:20:14
187;Добрый день. Подскажите, планируется ли доработать список абитуриентов на сайте, чтобы были фильтры, или хотябы экспорт в Excel для удобства пользования? Рядовая задача для студента ИРИТ 😉.;2025-06-28 13:21:44
188;Здравствуйте, какие льготы предоставляются детям ветеранов боевых действий в Чечне?;2025-06-28 13:45:49
189;"Добрый день, подскажите, чем отличаются программы ""Программная инженерия"" и ""Прикладная информатика""?";2025-06-28 17:04:00
190;"Есть ли отличия в программах ""Информатика и вычислительная техника"", ""Прикладная информатика"" и ""Программная инженерия""?";2025-06-28 17:40:26
191;Здравствуйте! А где можно посмотреть учебный план ИВТ программы Алгоритмы искусственного интеллекта и сильно оно отличается от классического ИВТ?;2025-06-28 18:49:48
192;такой же вопрос по прикладной информатике и ее программе, связанной с ии?;2025-06-28 18:51:30
193;Подскажите, пожалуйста, где можно найти таблицу с планом приема на 2024 год, где указано количество мест для поступления в УРФУ?;2025-06-28 20:05:09
194;Не ответили на мой вопрос. Нужен план приема на 2024 год, а не на 2025. Подскажите , пожалуйста, где взять?;2025-06-29 04:38:38
195;Здравствуйте, а можно будет посмотреть какие были баллы на направление Радиотехника заочная форма обучения?;2025-06-29 04:56:03
196;Ссылку нет возможности направить здесь?;2025-06-29 05:10:03
197;Подскажите , пожалуйста, раз вы уже подали, на госуслугах есть привязка  кода специальности к институту? Просто коды одинаковые (повторяются ) в разных институтах урфу. Как не ошибиться?;2025-06-29 06:18:17
198;"Подскажи на специальность 09.03.01. ""Информатика и вычислительная техника"" и 09.03.03. ""Прикладная информатика"" - Какие были проходные баллы на бюджет? Спрашиваю, потому как на разных источниках, показывают разные баллы. 😊";2025-06-29 06:19:52
199;Здравствуйте, на госуслугах при подаче заявления на специальность радиотехника пишет, что основных бюджетных мест 22, остальные места это целевое и их  18. На сайте ИРИТ РТФ написано, что бюджетных мест вообще 52, если верить госуслугам, то где ещё 12 бюджетных мест?;2025-06-29 06:55:49
200;Здравствуйте, баллы проф математика 58, информатика 56, русский 49, итого 163, есть ли возможность поступить на платное очное?;2025-06-29 08:06:57
201;Т.е. с меньшими баллами не поступить? А если есть особая квота?;2025-06-29 08:10:30
202;"1)Если сдавал физику и дополнительно информатику, в зачёт пойдет результат  экзамена с большим баллом? 
2) подал заявления через госуслуги, 3 июля пересдаю информатику (набрал больше минималки, но верю, что могу лучше). Автоматически кол-во баллов пересчитывается?";2025-06-29 09:05:24
203;Здравствуйте, подал документы через гос услуги, где можно взять ID для отслеживания себя в списках?;2025-06-29 09:18:03
204;Личный кабинет на сайте УРФУ откроется автоматически после подачи заявления через гос.услуги???;2025-06-29 10:04:48
