id;question;timestamp
325;Если документы в вуз подавали вживую, то можно будет заявление на зачисление заполнить онлайн?;2025-07-02 18:24:43
326;Куда загружать аттестат? Про это на госуслугах ничего не написано, просят только номер аттестата ввести.;2025-07-02 18:36:19
327;Кто нибудь загружал аттестат включая вкладыш с оценками?;2025-07-02 18:37:00
328;Спасибо! Правильно понимаю, что хоть и подовали заявление через госуслуги, но нужно ещё завести личный кабинет на сайте Урфу и подгрузить туда копии всех перечисленных документов?;2025-07-03 01:37:28
329;"Здравствуйте, я гражданин Таджикистана, подал заявление о поступлении через гос услуги и через личный кабинет, загрузив все документы. Статус заявления сейчас ""ждём результатов испытания"" . Я хотел уточнить, когда будет список испытаний ?";2025-07-03 02:35:37
330;Доброе утро!! Возможно прикрепить фото, к уже отправленному заявлению через ГУ? Как то мы этот момент пропустили….;2025-07-03 05:55:54
331;Здравствуйте, если подавали заявление через госуслуги, нужно ли заполнять все данные в личном кабинете, прикреплять все документы? на Госуслугах статус заявления - ожидаются результаты испытаний, что это значит?;2025-07-03 06:14:01
332;Ааа,понятно. А какой надо выбрать?;2025-07-03 06:40:27
333;"Здравствуйте, вопрос не относится к ИРИТ-РТФ, но не знаю куда его можно задать) 
Подскажите, как подтверждается золотая медаль на госуслугах, не могу найти?";2025-07-03 06:54:18
334;Добрый день! Подскажите, кто то уже писал вступительный экзамен «информационные технологии и сервисы»?;2025-07-03 06:56:06
335;Здравствуйте. Вопросы по ГТО. Если школьник сдаст ГТО 6.08.25, будет ли учитываться этот результат при подаче документов летом 2026? Учитывается только золотой знак?;2025-07-03 07:57:16
336;В списках подавших документы отсутствуют сведения об аттестате с отличием и об участии в олимпиаде Изумруд, на госуслугах данные отображены. Когда данные обновятся в списках?;2025-07-03 08:03:57
337;?;2025-07-03 09:13:42
338;Здравствуйте, подскажите когда примерно будут рейтинговые списки по  вашему институт?;2025-07-03 12:34:19
339;ВИ на бакалавриат в Ирит Ртф только для иностранных поступающих ?;2025-07-03 12:52:10
340;Здравствуйте, а где через госуслуги можно поменять формат сдачи внутреннего экзамена (с заочного на очный в университете)?;2025-07-03 12:54:29
341;"Для высокобалльников и топов бюджетного списка  приоритет в новые общаги?
После переезда в новый корпус института возможно ли что всех переведут в новые общаги?";2025-07-03 12:57:54
342;У кого тоже все еще аттестат не подтвердили на госуслугах?;2025-07-03 13:01:06
343;Само подгружалось?;2025-07-03 15:32:25
344;А вы что подгружали про ГТО? УИН или приказ о присвоении?;2025-07-03 16:51:32
345;Здравствуйте! Подскажите, есть ли демо-версии вступительных испытаний по 2.09.04.01, кроме того pdf файла с 38 вопросами? Не смог найти информацию. Исходя из того, что смог найти, как будто-бы есть, но не могу понять где их можно найти.;2025-07-04 02:57:58
346;На Госуслугах если подали заявление только в один ваш Вуз.Другие Вузы еще изучаем.А если уже будет статус в Госуслугах -Участвует в конкурсе?То уже нельзя будет в это заявление добавить оставшиеся 4 Вуза?;2025-07-04 06:06:44
347;"Здравствуйте. У нас уже несколько дней висит статус ""на рассмотрении"" Говорили о 2,5 днях. Сейчас  снова нужно потерпеть? Сколько ещё?";2025-07-04 07:27:42
348;ручные олимпиады пока ждём, верно?;2025-07-04 07:39:56
349;"Даже те, у кого статус ""Участвует в конкурсе""?";2025-07-04 07:42:32
350;"""участвует в конкурсе"" значит зачислен в списки?";2025-07-04 07:56:11
351;а как они это делают?;2025-07-04 08:05:45
352;"Здравствуйте, а если на госуслгах сначала ""Диплом о среднем профессиональном образовании"" был не подтверждён, а потом подтвердился. Как я понимаю мне не о чем беспокоиться?";2025-07-04 08:13:50
353;Поняла. а до какой даты можно заключить договор?;2025-07-04 08:14:51
354;Здравствуйте, почему на сайте ирит разместили большее количество мест, чем на госуслугах?;2025-07-04 09:01:47
355;Добрый день! Является ли обязательным условием участия в конкурсе на платные места заключение договора и внесение оплаты? У многих вузов срок заключения договоров - конец августа. Если заключение договоров в УрФУ до 5 сентября, то когда будут известны результаты конкурса и студенты приступают к обучению?;2025-07-04 09:03:08
356;Спасибо за ответ. Это означает, что поступающий с более высоким баллом, заключивший договор 5-8 сентября может вытеснить из конкурса другого? Как в этом случае? Возвращаются деньги и выбывший остаётся без места или он может участвовать в конкурсе по другой программе в соответствии с приоритетами?;2025-07-04 09:14:14
357;Спасибо. А есть ли примерные цифры проходного балла на платное обучение по программам вашего института?;2025-07-04 09:20:56
358;"@den757 
добрый день
подскажите, гто сдан
на руках есть приказ о присвоении золотого значка. на сайте гто по уин все есть
но удостоверение в область еще не пришло, и госуслуги по уин ничего не находят

при подаче документов через ГУ прикреплять сам приказ ?";2025-07-04 09:22:04
359;Подали документы 30, на ГУ статус на рассмотрении, в личном кабинете - участвует в конкурсе, но нет баллов за участие в Изумруде и книжку волонтёра. Ещё ожидать?;2025-07-04 09:32:11
360;Здравствуйте, подал заявление через госуслуги на 4 направления, можно ли добавить ещё одно направление после подачи заявления через те же гос услуги? Если да, то как, не могу найти;2025-07-04 10:19:29
361;здравствуйте, можно ли поступить на программную инженерию, прикладную информатику или ИВТ по вступительным экзаменам, а не баллам ЕГЭ после 11 класса гражданину РФ?;2025-07-04 11:07:25
362;Здравствуйте, какой был минимальный балл по радиотехники в 2024 году?;2025-07-04 12:40:53
363;Подскажите пожалуйста, если сейчас подали заявление  на 5 специальностей на бюджет и вдруг не пройдём, то можно будет потом заключить контракт? Или нужно сразу до 25.07 контракт тоже ставить галочку на госуслугах?;2025-07-04 13:03:17
364;Здравствуйте, подал документы через госуслуги и вуз сам назначил даты проведения вступительных испытаний. Мне необходимо сдать их именно в эти дни? Или возможно в любой день до 25?;2025-07-04 14:46:42
365;"Добрый день! Что нужно подгружать в индивидуальные достижения для получения доп. баллов за участие в финале ""изумруда""?";2025-07-04 16:19:50
366;Пожалуйста, Можно подробнее? Представим худшее, не прошли по конкурсу на бюджет и в списках отсутствует абитуриент 06.08. Можно будет после этого подавать на платное обучение , те в течение августа? Или это надо делать заранее? Если заранее , то какие предельные сроки по подаче заявление на платное обучение ?;2025-07-04 16:56:16
367;"Здравствуйте, а получается те списки, которые вы говорили будут опубликованы до 15.07 - это и есть ""зелёные списки"" ?";2025-07-04 18:07:35
368;Здравствуйте,хотел спросить,18-го числа уже дедлайн и пройти регистрацию на поступление уже не получится правильно?;2025-07-04 18:13:05
369;Это будет же после рассмотрения заявления?;2025-07-05 05:25:58
370;Я Гражданин Азербайджана,я могу поступить без экзаменов?;2025-07-05 05:56:41
